Chapter_Number,Chapter_Title,Section_Identifier,Section_Title,Section_Text
I,PRELIMINARY,"Section 1 (1)",Short title extent commencement and application.,"This Act may be called the Consumer Protection Act, 2019."
I,PRELIMINARY,"Section 1 (2)",Short title extent commencement and application.,"It extends to the whole of India."
I,PRELIMINARY,"Section 1 (3)",Short title extent commencement and application.,"It shall come into force on such date as the Central Government may, by notification, appoint and different dates may be appointed for different States and for different provisions of this Act and any reference in any such provision to the commencement of this Act shall be construed as a reference to the coming into force of that provision."
I,PRELIMINARY,"Section 1 (4)",Short title extent commencement and application.,"Save as otherwise expressly provided by the Central Government, by notification, this Act shall apply to all goods and services."
I,PRELIMINARY,"Section 2 (1)",Definitions.,"""advertisement"" means any audio or visual publicity, representation, endorsement or pronouncement made by means of light, sound, smoke, gas, print, electronic media, internet or website and includes any notice, circular, label, wrapper, invoice or such other documents;"
I,PRELIMINARY,"Section 2 (2)",Definitions.,"""appropriate laboratory"" means a laboratory or an organisation— (i) recognised by the Central Government; or (ii) recognised by a State Government, subject to such guidelines as may be issued by the Central Government in this behalf; or (iii) established by or under any law for the time being in force, which is maintained, financed or aided by the Central Government or a State Government for carrying out analysis or test of any goods with a view to determining whether such goods suffer from any defect;"
I,PRELIMINARY,"Section 2 (3)",Definitions.,"""branch office"" means— (i) any office or place of work described as a branch by the establishment; or (ii) any establishment carrying on either the same or substantially the same activity carried on by the head office of the establishment;"
I,PRELIMINARY,"Section 2 (4)",Definitions.,"""Central Authority"" means the Central Consumer Protection Authority established under section 10;"
I,PRELIMINARY,"Section 2 (5)",Definitions.,"""complainant"" means— (i) a consumer; or (ii) any voluntary consumer association registered under any law for the time being in force; or (iii) the Central Government or any State Government; or (iv) the Central Authority; or (v) one or more consumers, where there are numerous consumers having the same interest; or (vi) in case of death of a consumer, his legal heir or legal representative; or (vii) in case of a consumer being a minor, his parent or legal guardian;"
I,PRELIMINARY,"Section 2 (6)",Definitions.,"""complaint"" means any allegation in writing, made by a complainant for obtaining any relief provided by or under this Act, that— (i) an unfair contract or unfair trade practice or a restrictive trade practice has been adopted by any trader or service provider; (ii) the goods bought by him or agreed to be bought by him suffer from one or more defects; (iii) the services hired or availed of or agreed to be hired or availed of by him suffer from any deficiency; (iv) a trader or a service provider, as the case may be, has charged for the goods or for the services mentioned in the complaint, a price in excess of the price— (a) fixed by or under any law for the time being in force; or (b) displayed on the goods or any package containing such goods; or (c) displayed on the price list exhibited by him by or under any law for the time being in force; or (d) agreed between the parties; (v) the goods, which are hazardous to life and safety when used, are being offered for sale to the public— (a) in contravention of standards relating to safety of such goods as required to be complied with, by or under any law for the time being in force; (b) where the trader knows that the goods so offered are unsafe to the public; (vi) the services which are hazardous or likely to be hazardous to life and safety of the public when used, are being offered by a person who provides any service and who knows it to be injurious to life and safety; (vii) a claim for product liability action lies against the product manufacturer, product seller or product service provider, as the case may be;"
I,PRELIMINARY,"Section 2 (7)",Definitions.,"""consumer"" means any person who— (i) buys any goods for a consideration which has been paid or promised or partly paid and partly promised, or under any system of deferred payment and includes any user of such goods other than the person who buys such goods for consideration paid or promised or partly paid or partly promised, or under any system of deferred payment, when such use is made with the approval of such person, but does not include a person who obtains such goods for resale or for any commercial purpose; or (ii) hires or avails of any service for a consideration which has been paid or promised or partly paid and partly promised, or under any system of deferred payment and includes any beneficiary of such service other than the person who hires or avails of the services for consideration paid or promised, or partly paid and partly promised, or under any system of deferred payment, when such services are availed of with the approval of the first mentioned person, but does not include a person who avails of such service for any commercial purpose. Explanation.—For the purposes of this clause,— (a) the expression ""commercial purpose"" does not include use by a person of goods bought and used by him exclusively for the purpose of earning his livelihood, by means of self-employment; (b) the expressions ""buys any goods"" and ""hires or avails any services"" includes offline or online transactions through electronic means or by teleshopping or direct selling or multi-level marketing;"
I,PRELIMINARY,"Section 2 (8)",Definitions.,"""consumer dispute"" means a dispute where the person against whom a complaint has been made, denies or disputes the allegations contained in the complaint;"
I,PRELIMINARY,"Section 2 (9)",Definitions.,"""consumer rights"" includes,— (i) the right to be protected against the marketing of goods, products or services which are hazardous to life and property; (ii) the right to be informed about the quality, quantity, potency, purity, standard and price of goods, products or services, as the case may be, so as to protect the consumer against unfair trade practices; (iii) the right to be assured, wherever possible, access to a variety of goods, products or services at competitive prices; (iv) the right to be heard and to be assured that consumer's interests will receive due consideration at appropriate fora; (v) the right to seek redressal against unfair trade practice or restrictive trade practices or unscrupulous exploitation of consumers; and (vi) the right to consumer awareness;"
I,PRELIMINARY,"Section 2 (10)",Definitions.,"""defect"" means any fault, imperfection or shortcoming in the quality, quantity, potency, purity or standard which is required to be maintained by or under any law for the time being in force or under any contract, express or implied or as is claimed by the trader in any manner whatsoever in relation to any goods or product and the expression ""defective"" shall be construed accordingly;"
I,PRELIMINARY,"Section 2 (11)",Definitions.,"""deficiency"" means any fault, imperfection, shortcoming or inadequacy in the quality, nature and manner of performance which is required to be maintained by or under any law for the time being in force or has been undertaken to be performed by a person in pursuance of a contract or otherwise in relation to any service and includes— (i) any act of negligence or omission or commission by such person which causes loss or injury to the consumer; and (ii) deliberate withholding of relevant information by such person to the consumer;"
I,PRELIMINARY,"Section 2 (12)",Definitions.,"""design"", in relation to a product, means the intended or known physical and material characteristics of such product and includes any intended or known formulation or content of such product and the usual result of the intended manufacturing or other process used to produce such product;"
I,PRELIMINARY,"Section 2 (13)",Definitions.,"""direct selling"" means marketing, distribution and sale of goods or provision of services through a network of sellers, other than through a permanent retail location;"
I,PRELIMINARY,"Section 2 (14)",Definitions.,"""Director-General"" means the Director-General appointed under sub-section (2) of section 15;"
I,PRELIMINARY,"Section 2 (15)",Definitions.,"""District Commission"" means a District Consumer Disputes Redressal Commission established under sub-section (1) of section 28;"
I,PRELIMINARY,"Section 2 (16)",Definitions.,"""e-commerce"" means buying or selling of goods or services including digital products over digital or electronic network;"
I,PRELIMINARY,"Section 2 (17)",Definitions.,"""electronic service provider"" means a person who provides technologies or processes to enable a product seller to engage in advertising or selling goods or services to a consumer and includes any online market place or online auction sites;"
I,PRELIMINARY,"Section 2 (18)",Definitions.,"""endorsement"", in relation to an advertisement, means— (i) any message, verbal statement, demonstration; or (ii) depiction of the name, signature, likeness or other identifiable personal characteristics of an individual; or (iii) depiction of the name or seal of any institution or organisation, which makes the consumer to believe that it reflects the opinion, finding or experience of the person making such endorsement;"
I,PRELIMINARY,"Section 2 (19)",Definitions.,"""establishment"" includes an advertising agency, commission agent, manufacturing, trading or any other commercial agency which carries on any business, trade or profession or any work in connection with or incidental or ancillary to any commercial activity, trade or profession, or such other class or classes of persons including public utility entities in the manner as may be prescribed;"
I,PRELIMINARY,"Section 2 (20)",Definitions.,"""express warranty"" means any material statement, affirmation of fact, promise or description relating to a product or service warranting that it conforms to such material statement, affirmation, promise or description and includes any sample or model of a product warranting that the whole of such product conforms to such sample or model;"
I,PRELIMINARY,"Section 2 (21)",Definitions.,"""goods"" means every kind of movable property and includes ""food"" as defined in clause (j) of sub-section (1) of section 3 of the Food Safety and Standards Act, 2006;"
I,PRELIMINARY,"Section 2 (22)",Definitions.,"""harm"", in relation to a product liability, includes— (i) damage to any property, other than the product itself; (ii) personal injury, illness or death; (iii) mental agony or emotional distress attendant to personal injury or illness or damage to property; or (iv) any loss of consortium or services or other loss resulting from a harm referred to in sub-clause (i) or sub-clause (ii) or sub-clause (iii), but shall not include any harm caused to a product itself or any damage to the property on account of breach of warranty conditions or any commercial or economic loss, including any direct, incidental or consequential loss relating thereto;"
I,PRELIMINARY,"Section 2 (23)",Definitions.,"""injury"" means any harm whatever illegally caused to any person, in body, mind or property;"
I,PRELIMINARY,"Section 2 (24)",Definitions.,"""manufacturer"" means a person who— (i) makes any goods or parts thereof; or (ii) assembles any goods or parts thereof made by others; or (iii) puts or causes to be put his own mark on any goods made by any other person;"
I,PRELIMINARY,"Section 2 (25)",Definitions.,"""mediation"" means the process by which a mediator mediates the consumer disputes;"
I,PRELIMINARY,"Section 2 (26)",Definitions.,"""mediator"" means a mediator referred to in section 75;"
I,PRELIMINARY,"Section 2 (27)",Definitions.,"""member"" includes the President and a member of the National Commission or a State Commission or a District Commission, as the case may be;"
I,PRELIMINARY,"Section 2 (28)",Definitions.,"""misleading advertisement"" in relation to any product or service, means an advertisement, which— (i) falsely describes such product or service; or (ii) gives a false guarantee to, or is likely to mislead the consumers as to the nature, substance, quantity or quality of such product or service; or (iii) conveys an express or implied representation which, if made by the manufacturer or seller or service provider thereof, would constitute an unfair trade practice; or (iv) deliberately conceals important information;"
I,PRELIMINARY,"Section 2 (29)",Definitions.,"""National Commission"" means the National Consumer Disputes Redressal Commission established under sub-section (1) of section 53;"
I,PRELIMINARY,"Section 2 (30)",Definitions.,"""notification"" means a notification published in the Official Gazette and the term ""notify"" shall be construed accordingly;"
I,PRELIMINARY,"Section 2 (31)",Definitions.,"""person"" includes— (i) an individual; (ii) a firm whether registered or not; (iii) a Hindu undivided family; (iv) a co-operative society; (v) an association of persons whether registered under the Societies Registration Act, 1860 or not; (vi) any corporation, company or a body of individuals whether incorporated or not; (vii) any artificial juridical person, not falling within any of the preceding sub-clauses;"
I,PRELIMINARY,"Section 2 (32)",Definitions.,"""prescribed"" means prescribed by rules made by the Central Government, or, as the case may be, the State Government;"
I,PRELIMINARY,"Section 2 (33)",Definitions.,"""product"" means any article or goods or substance or raw material or any extended cycle of such product, which may be in gaseous, liquid, or solid state possessing intrinsic value which is capable of delivery either as wholly assembled or as a component part and is produced for introduction to trade or commerce, but does not include human tissues, blood, blood products and organs;"
I,PRELIMINARY,"Section 2 (34)",Definitions.,"""product liability"" means the responsibility of a product manufacturer or product seller, of any product or service, to compensate for any harm caused to a consumer by such defective product manufactured or sold or by deficiency in services relating thereto;"
I,PRELIMINARY,"Section 2 (35)",Definitions.,"""product liability action"" means a complaint filed by a person before a District Commission or State Commission or National Commission, as the case may be, for claiming compensation for the harm caused to him;"
I,PRELIMINARY,"Section 2 (36)",Definitions.,"""product manufacturer"" means a person who— (i) makes any product or parts thereof; or (ii) assembles parts thereof made by others; or (iii) puts or causes to be put his own mark on any products made by any other person; or (iv) makes a product and sells, distributes, leases, installs, prepares, packages, labels, markets, repairs, maintains such product or is otherwise involved in placing such product for commercial purpose; or (v) designs, produces, fabricates, constructs or re-manufactures any product before its sale; or (vi) being a product seller of a product, is also a manufacturer of such product;"
I,PRELIMINARY,"Section 2 (37)",Definitions.,"""product seller"", in relation to a product, means a person who, in the course of business, imports, sells, distributes, leases, installs, prepares, packages, labels, markets, repairs, maintains, or otherwise is involved in placing such product for commercial purpose and includes— (i) a manufacturer who is also a product seller; or (ii) a service provider, but does not include— (a) a seller of immovable property, unless such person is engaged in the sale of constructed house or in the construction of homes or flats; (b) a provider of professional services in any transaction in which, the sale or use of a product is only incidental thereto, but furnishing of opinion, skill or services being the essence of such transaction; (c) a person who— (I) acts only in a financial capacity with respect to the sale of the product; (II) is not a manufacturer, wholesaler, distributor, retailer, direct seller or an electronic service provider; (III) leases a product, without having a reasonable opportunity to inspect and discover defects in the product, under a lease arrangement in which the selection, possession, maintenance, and operation of the product are controlled by a person other than the lessor;"
I,PRELIMINARY,"Section 2 (38)",Definitions.,"""product service provider"", in relation to a product, means a person who provides any service in respect of such product;"
I,PRELIMINARY,"Section 2 (39)",Definitions.,"""regulations"" means the regulations made by the National Commission, or as the case may be, the Central Authority;"
I,PRELIMINARY,"Section 2 (40)",Definitions.,"""Regulator"" means a body or any authority established under any other law for the time being in force;"
I,PRELIMINARY,"Section 2 (41)",Definitions.,"""restrictive trade practice"" means a trade practice which tends to bring about manipulation of price or its conditions of delivery or to affect flow of supplies in the market relating to goods or services in such a manner as to impose on the consumers unjustified costs or restrictions and shall include— (i) delay beyond the period agreed to by a trader in supply of such goods or in providing the services which has led or is likely to lead to rise in the price; (ii) any trade practice which requires a consumer to buy, hire or avail of any goods or, as the case may be, services as condition precedent for buying, hiring or availing of other goods or services;"
I,PRELIMINARY,"Section 2 (42)",Definitions.,"""service"" means service of any description which is made available to potential users and includes, but not limited to, the provision of facilities in connection with banking, financing, insurance, transport, processing, supply of electrical or other energy, telecom, boarding or lodging or both, housing construction, entertainment, amusement or the purveying of news or other information, but does not include the rendering of any service free of charge or under a contract of personal service;"
I,PRELIMINARY,"Section 2 (43)",Definitions.,"""spurious goods"" means such goods which are falsely claimed to be genuine;"
I,PRELIMINARY,"Section 2 (44)",Definitions.,"""State Commission"" means a State Consumer Disputes Redressal Commission established under sub-section (1) of section 42;"
I,PRELIMINARY,"Section 2 (45)",Definitions.,"""trader"", in relation to any goods, means a person who sells or distributes any goods for sale and includes the manufacturer thereof, and where such goods are sold or distributed in package form, includes the packer thereof;"
I,PRELIMINARY,"Section 2 (46)",Definitions.,"""unfair contract"" means a contract between a manufacturer or trader or service provider on one hand, and a consumer on the other, having such terms which cause significant change in the rights of such consumer, including the following, namely:— (i) requiring manifestly excessive security deposits to be given by a consumer for the performance of contractual obligations; or (ii) imposing any penalty on the consumer, for the breach of contract thereof which is wholly disproportionate to the loss occurred due to such breach to the other party to the contract; or (iii) refusing to accept early repayment of debts on payment of applicable penalty; or (iv) entitling a party to the contract to terminate such contract unilaterally, without reasonable cause; or (v) permitting or has the effect of permitting one party to assign the contract to the detriment of the other party who is a consumer, without his consent; or (vi) imposing on the consumer any unreasonable charge, obligation or condition which puts such consumer to disadvantage;"
